<?xml version="1.0" encoding="UTF-8"?>

<list xsi:noNamespaceSchemaLocation="schemavideogame.xsd" xmlns:xsi="http://www.w3.org/2001/XMLSchema-instance">
	<game>
		<presentation>
			<genders>
				<gender id="">Action</gender>
				<gender id="">MÃ©lodramatique</gender>
			</genders>
			<title>ThisIsAVideoGame</title>
			<editors>
				<editor id="">An editor</editor>
			</editors>
			<themes>
				<theme id=""></theme>
			</themes>
			<site></site>
			<consoles>
				<console id="">
					<businessModel></businessModel>
					<pegi></pegi>
					<modes>
						<mode id=""></mode>
					</modes>
					<cover>
						<front url="test" />
						<back url="/location/to/content" />
					</cover>
					<supports>
						<support id=""></support>
					</supports>
					<release>2015-01-25</release>
					<editions>
						<edition id="">
							<name></name>
							<content></content>
							<shops>
								<shop id="" url="test">
									<name></name>
									<price devise="euro"></price>
								</shop>
							</shops>
						</edition>
					</editions>
					<name></name>
					<description></description>
					<dlcs>
						<dlc id="">
							<title></title>
							<description></description>
							<price devise="euro"></price>
						</dlc>
					</dlcs>
					<configs>
						<config id="" type="minimale"></config>
						<config id="" type="optimale"></config>
					</configs>
					<test>	
						<report></report>
						<date>2015-01-22T11:33:33</date>
						<userName></userName>
						<note>1</note>
						<comments>
							<comment id="">
								<text></text>
								<date>2015-01-22T11:33:33</date>
								<userName></userName>
								<note>3</note>
								<like>0</like>
								<dislike>0</dislike>
							</comment>
						</comments>
						<analyses>
							<analyse id="" type="positive"></analyse>
							<analyse id="" type="negative"></analyse>
						</analyses>
					</test>
				</console>
			</consoles>
			<languages>
				<language id=""></language>
			</languages>
		</presentation>
		
		<articles>
			<article id="" type="news">
				<consolesNames>
					<consoleName></consoleName>
				</consolesNames>
				<title></title>
				<userName></userName>	
				<date>2015-01-22T11:33:33</date>		
			</article>
		</articles>
		
		<medias>
			<media id="" type="video" url="path/to/media" >
				<consolesNames>
					<consoleName></consoleName>
				</consolesNames>
				<dimensions unit="pt" width="32.4" height="90.5" />
			</media>
		</medias>
		
		<tips>
			<tip id="">
				<consolesNames>
					<consoleName></consoleName>
				</consolesNames>
				<content></content>
			</tip>
		</tips>
	</game>
</list>
